{"$defs":{"BindingWire":{"additionalProperties":false,"properties":{"annotation_artifact_digest":{"type":"string"},"public_case_artifact_digest":{"type":"string"}},"required":["public_case_artifact_digest","annotation_artifact_digest"],"type":"object"}},"$id":"schemas/evidentrail/v1/bench_hidden_evaluation_manifest.schema.json","$schema":"https://json-schema.org/draft/2020-12/schema","additionalProperties":false,"properties":{"annotation_set_artifact_digest":{"pattern":"^artifact_sha256_[0-9a-f]{64}$","type":"string"},"case_bindings":{"items":{"$ref":"#/$defs/BindingWire"},"maxItems":4096,"type":"array"},"contract":{"const":"evidentrail.bench.hidden_evaluation_manifest","type":"string"},"contract_version":{"const":1,"format":"uint16","maximum":9007199254740991,"minimum":0,"type":"integer"},"public_run_manifest_artifact_digest":{"pattern":"^artifact_sha256_[0-9a-f]{64}$","type":"string"},"scoring_spec_artifact_digest":{"pattern":"^artifact_sha256_[0-9a-f]{64}$","type":"string"}},"required":["contract","contract_version","public_run_manifest_artifact_digest","annotation_set_artifact_digest","scoring_spec_artifact_digest","case_bindings"],"title":"evidentrail.bench.hidden_evaluation_manifest","type":"object"}