{"annotation_set_artifact_digest":"artifact_sha256_0000000000000000000000000000000000000000000000000000000000000000","case_bindings":[{"annotation_artifact_digest":"artifact_sha256_0000000000000000000000000000000000000000000000000000000000000000","public_case_artifact_digest":"artifact_sha256_0000000000000000000000000000000000000000000000000000000000000000"}],"contract":"evidentrail.bench.hidden_evaluation_manifest","contract_version":1,"public_run_manifest_artifact_digest":"artifact_sha256_0000000000000000000000000000000000000000000000000000000000000000","scoring_spec_artifact_digest":"artifact_sha256_0000000000000000000000000000000000000000000000000000000000000000"}